{
  "panel_version": "0.1.0",
  "layer": "tool",
  "subject": {
    "name": "DictaWhisper MCP Server",
    "canonical_url": "https://dictawhisper.com",
    "publisher": "Catalyst Forge",
    "version": "0.1.2"
  },
  "subject_identity": {
    "identity_confidence": "partial",
    "package": "npm:dictawhisper",
    "version": "0.1.2"
  },
  "rows": [
    {
      "key": "kind",
      "label": "Kind",
      "value": "mcp-server",
      "type": "enum",
      "severity": "info"
    },
    {
      "key": "runtime",
      "label": "Runtime",
      "value": "local-process",
      "type": "enum",
      "severity": "info"
    },
    {
      "key": "transport",
      "label": "Transport",
      "value": "stdio",
      "type": "enum",
      "severity": "info"
    },
    {
      "key": "credentials",
      "label": "Credentials",
      "value": "none",
      "type": "enum",
      "severity": "info"
    },
    {
      "key": "side_effects_worst",
      "label": "Worst side effect",
      "value": "read",
      "type": "enum",
      "severity": "info"
    },
    {
      "key": "filesystem",
      "label": "Filesystem",
      "value": "scoped",
      "type": "enum",
      "severity": "caution"
    },
    {
      "key": "network",
      "label": "Network",
      "value": "none",
      "type": "enum",
      "severity": "info"
    },
    {
      "key": "processes",
      "label": "Processes",
      "value": false,
      "type": "enum",
      "severity": "info"
    },
    {
      "key": "egress_destinations",
      "label": "Egress destinations",
      "value": "none",
      "type": "enum",
      "severity": "info"
    },
    {
      "key": "telemetry",
      "label": "Telemetry",
      "value": "none",
      "type": "enum",
      "severity": "info"
    },
    {
      "key": "idempotent",
      "label": "Idempotent",
      "value": true,
      "type": "enum",
      "severity": "info"
    },
    {
      "key": "license",
      "label": "License",
      "value": "MIT",
      "type": "scalar",
      "severity": "info"
    }
  ],
  "provenance": {
    "profile": "tool-facts",
    "profile_version": "0.1.0",
    "source_format": "tool-facts/md",
    "source_version": "0.1.0",
    "source_url": "file://z:\\workspace\\x-facts\\specs\\profiles\\tool-facts\\test-vectors\\dictawhisper-mcp.source.md",
    "fetched_at": "2026-09-16T00:00:00.000Z",
    "content_digest": "sha256:66cd4f78391bdcdb2302ed1b9da94d1a62b8bf3906dd80ab6843127ef5cae0ef",
    "digest_canonicalization": "jcs-rfc8785+frontmatter-only+tools-sorted",
    "verification": "self-asserted",
    "signature": "none",
    "attribution": "Panel projected from TOOL_FACTS.md by xFacts. Native / xFacts-defined stopgap, not a live tools/list.",
    "non_endorsement": "This profile reads an xFacts-defined format. It is not an MCP artifact and is not a certificate."
  },
  "freshness": {
    "ttl_seconds": 3600,
    "stale": false
  },
  "unmapped_fields": [
    "credits",
    "developer",
    "generated",
    "homepage",
    "name",
    "repository",
    "status",
    "tool_facts_version",
    "tools[].name",
    "tools[].purpose",
    "version"
  ]
}
