{
  "panel_version": "0.1.0",
  "layer": "tool",
  "subject": {
    "name": "ollanet MCP Server",
    "canonical_url": "https://ollanet.dev",
    "publisher": "Catalyst Forge",
    "version": "0.6.13"
  },
  "subject_identity": {
    "identity_confidence": "partial",
    "package": "npm:ollanet",
    "version": "0.6.13"
  },
  "rows": [
    {
      "key": "kind",
      "label": "Kind",
      "value": "mcp-server",
      "type": "enum",
      "severity": "info"
    },
    {
      "key": "runtime",
      "label": "Runtime",
      "value": "local-process",
      "type": "enum",
      "severity": "info"
    },
    {
      "key": "transport",
      "label": "Transport",
      "value": "stdio",
      "type": "enum",
      "severity": "info"
    },
    {
      "key": "credentials",
      "label": "Credentials",
      "value": "undisclosed",
      "type": "undisclosed",
      "severity": "caution"
    },
    {
      "key": "side_effects_worst",
      "label": "Worst side effect",
      "value": "destructive",
      "type": "enum",
      "severity": "danger"
    },
    {
      "key": "filesystem",
      "label": "Filesystem",
      "value": "undisclosed",
      "type": "undisclosed",
      "severity": "caution"
    },
    {
      "key": "network",
      "label": "Network",
      "value": "unrestricted",
      "type": "enum",
      "severity": "danger"
    },
    {
      "key": "processes",
      "label": "Processes",
      "value": "undisclosed",
      "type": "undisclosed",
      "severity": "caution"
    },
    {
      "key": "egress_destinations",
      "label": "Egress destinations",
      "value": "undisclosed",
      "type": "undisclosed",
      "severity": "caution"
    },
    {
      "key": "telemetry",
      "label": "Telemetry",
      "value": "undisclosed",
      "type": "undisclosed",
      "severity": "caution"
    },
    {
      "key": "idempotent",
      "label": "Idempotent",
      "value": false,
      "type": "enum",
      "severity": "caution"
    },
    {
      "key": "license",
      "label": "License",
      "value": "undisclosed",
      "type": "undisclosed",
      "severity": "caution"
    }
  ],
  "provenance": {
    "profile": "mcp-tools-list",
    "profile_version": "0.1.0",
    "source_format": "mcp/tools-list",
    "source_version": "2025-03-26",
    "source_url": "stdio://node Z:/workspace/ollanet/dist/cli.js mcp",
    "fetched_at": "2026-09-16T04:41:23.909Z",
    "content_digest": "sha256:fd4d6a4712d0d6068c7c7b44fd82f0f3ebd33ce67446ec98fadb3dab04db4ecc",
    "digest_canonicalization": "jcs-rfc8785+envelope-stripped+tools-sorted",
    "verification": "derived",
    "signature": "none",
    "attribution": "Panel derived from MCP tools/list by xFacts. Not an official MCP artifact.",
    "non_endorsement": "xFacts is not affiliated with or endorsed by the Model Context Protocol project."
  },
  "freshness": {
    "ttl_seconds": 3600,
    "stale": false
  },
  "unmapped_fields": [
    "tools[].description",
    "tools[].inputSchema",
    "tools[].name"
  ]
}
