{
  "panel_version": "0.1.0",
  "layer": "tool",
  "subject": {
    "name": "DictaWhisper MCP Server",
    "canonical_url": "https://dictawhisper.com",
    "publisher": "Catalyst Forge",
    "version": "0.1.1"
  },
  "subject_identity": {
    "identity_confidence": "partial",
    "package": "npm:dictawhisper",
    "version": "0.1.1"
  },
  "rows": [
    {
      "key": "kind",
      "label": "Kind",
      "value": "mcp-server",
      "type": "enum",
      "severity": "info"
    },
    {
      "key": "runtime",
      "label": "Runtime",
      "value": "local-process",
      "type": "enum",
      "severity": "info"
    },
    {
      "key": "transport",
      "label": "Transport",
      "value": "stdio",
      "type": "enum",
      "severity": "info"
    },
    {
      "key": "credentials",
      "label": "Credentials",
      "value": "undisclosed",
      "type": "undisclosed",
      "severity": "caution"
    },
    {
      "key": "side_effects_worst",
      "label": "Worst side effect",
      "value": "read",
      "type": "enum",
      "severity": "info"
    },
    {
      "key": "filesystem",
      "label": "Filesystem",
      "value": "undisclosed",
      "type": "undisclosed",
      "severity": "caution"
    },
    {
      "key": "network",
      "label": "Network",
      "value": "undisclosed",
      "type": "undisclosed",
      "severity": "caution"
    },
    {
      "key": "processes",
      "label": "Processes",
      "value": "undisclosed",
      "type": "undisclosed",
      "severity": "caution"
    },
    {
      "key": "egress_destinations",
      "label": "Egress destinations",
      "value": "undisclosed",
      "type": "undisclosed",
      "severity": "caution"
    },
    {
      "key": "telemetry",
      "label": "Telemetry",
      "value": "undisclosed",
      "type": "undisclosed",
      "severity": "caution"
    },
    {
      "key": "idempotent",
      "label": "Idempotent",
      "value": true,
      "type": "enum",
      "severity": "info"
    },
    {
      "key": "license",
      "label": "License",
      "value": "undisclosed",
      "type": "undisclosed",
      "severity": "caution"
    }
  ],
  "provenance": {
    "profile": "mcp-tools-list",
    "profile_version": "0.1.0",
    "source_format": "mcp/tools-list",
    "source_version": "2025-03-26",
    "source_url": "stdio://node --experimental-strip-types Z:/workspace/dictawhisper/src/mcp.ts",
    "fetched_at": "2026-09-16T04:41:23.909Z",
    "content_digest": "sha256:f4a20bc166e296e4872201e06a014e836577b63ae565e919928bab8fd5db57be",
    "digest_canonicalization": "jcs-rfc8785+envelope-stripped+tools-sorted",
    "verification": "derived",
    "signature": "none",
    "attribution": "Panel derived from MCP tools/list by xFacts. Not an official MCP artifact.",
    "non_endorsement": "xFacts is not affiliated with or endorsed by the Model Context Protocol project."
  },
  "freshness": {
    "ttl_seconds": 3600,
    "stale": false
  },
  "unmapped_fields": [
    "tools[].description",
    "tools[].inputSchema",
    "tools[].name"
  ]
}
